{
 "sec": "lead",
 "h": "Thousands Turn Out as the Tide Gala Opens in Emberline",
 "by": "By Alistair Fenwick, Globe staff",
 "body": [
  "Councilor Elowen Marsh called the vote 'a promise kept,' noting that work crews will begin surveying within the fortnight.",
  "The plan's backers say The Festival Green will employ hundreds of makers, printers, and engineers over its construction.",
  "A public reading of the full plan is scheduled at the Civic Athenaeum, and printed copies will be sold for a copper."
 ],
 "id": "JAH-ARTICLE-000001",
 "edition_id": "JAH-ED-000001",
 "fictionality_status": "FICTIONAL_GENERATED",
 "creation_mode": "GENERATED",
 "version": "1.0",
 "canonical_url": "https://justinahiggins614-cmyk.github.io/signature-newspapers/?article=JAH-ARTICLE-000001",
 "content_hash": "84d14369502a121da2a0e0aa94d85da9c9b6722034044422734069223c2ab9a6"
}